{"protocolVersion":1,"sessionId":"session-a","sequence":1842,"event":"heartbeat","track":{"trackId":"qq-晴天-269000","title":"晴天","artist":"周杰伦","album":"叶惠美","durationMs":269000},"playback":{"state":"playing","positionMs":35214,"speed":1.0,"capturedAtMonotonicMs":91827364},"source":{"packageName":"com.tencent.qqmusic","deviceId":"android-a"}}
